[I 2025-10-17 17:27:17,007] A new study created in memory with name: no-name-af451b25-8b6f-48dc-a158-3f1c7a687f6d
Loading data...
Loaded 2,184 candles
Buy&Hold: 147.65%

================================================================================
v04 Simple Strategy Optuna Optimization
================================================================================
Target: 170% return
Buy&Hold: 147.65%
Trials: 100
================================================================================

  0%|          | 0/100 [00:00<?, ?it/s]                                         0%|          | 0/100 [00:00<?, ?it/s]Best trial: 0. Best value: 0.604366:   0%|          | 0/100 [00:00<?, ?it/s]Best trial: 0. Best value: 0.604366:   1%|          | 1/100 [00:00<00:11,  8.87it/s]                                                                                    Best trial: 0. Best value: 0.604366:   1%|          | 1/100 [00:00<00:11,  8.87it/s]Best trial: 1. Best value: 0.630809:   1%|          | 1/100 [00:00<00:11,  8.87it/s]Best trial: 1. Best value: 0.630809:   2%|▏         | 2/100 [00:00<00:10,  9.12it/s]                                                                                    Best trial: 1. Best value: 0.630809:   2%|▏         | 2/100 [00:00<00:10,  9.12it/s]Best trial: 1. Best value: 0.630809:   2%|▏         | 2/100 [00:00<00:10,  9.12it/s]Best trial: 1. Best value: 0.630809:   3%|▎         | 3/100 [00:00<00:10,  9.27it/s]                                                                                    Best trial: 1. Best value: 0.630809:   3%|▎         | 3/100 [00:00<00:10,  9.27it/s]Best trial: 3. Best value: 0.658217:   3%|▎         | 3/100 [00:00<00:10,  9.27it/s]Best trial: 3. Best value: 0.658217:   4%|▍         | 4/100 [00:00<00:10,  9.36it/s]                                                                                    Best trial: 3. Best value: 0.658217:   4%|▍         | 4/100 [00:00<00:10,  9.36it/s]Best trial: 3. Best value: 0.658217:   4%|▍         | 4/100 [00:00<00:10,  9.36it/s]Best trial: 3. Best value: 0.658217:   5%|▌         | 5/100 [00:00<00:10,  9.34it/s]                                                                                    Best trial: 3. Best value: 0.658217:   5%|▌         | 5/100 [00:00<00:10,  9.34it/s]Best trial: 3. Best value: 0.658217:   5%|▌         | 5/100 [00:00<00:10,  9.34it/s]Best trial: 3. Best value: 0.658217:   6%|▌         | 6/100 [00:00<00:10,  9.33it/s]                                                                                    Best trial: 3. Best value: 0.658217:   6%|▌         | 6/100 [00:00<00:10,  9.33it/s]Best trial: 3. Best value: 0.658217:   6%|▌         | 6/100 [00:00<00:10,  9.33it/s]Best trial: 3. Best value: 0.658217:   7%|▋         | 7/100 [00:00<00:09,  9.39it/s]                                                                                    Best trial: 3. Best value: 0.658217:   7%|▋         | 7/100 [00:00<00:09,  9.39it/s]Best trial: 3. Best value: 0.658217:   7%|▋         | 7/100 [00:00<00:09,  9.39it/s]Best trial: 3. Best value: 0.658217:   8%|▊         | 8/100 [00:00<00:09,  9.42it/s]                                                                                    Best trial: 3. Best value: 0.658217:   8%|▊         | 8/100 [00:00<00:09,  9.42it/s]Best trial: 3. Best value: 0.658217:   8%|▊         | 8/100 [00:00<00:09,  9.42it/s]Best trial: 3. Best value: 0.658217:   9%|▉         | 9/100 [00:00<00:09,  9.41it/s]                                                                                    Best trial: 3. Best value: 0.658217:   9%|▉         | 9/100 [00:01<00:09,  9.41it/s]Best trial: 3. Best value: 0.658217:   9%|▉         | 9/100 [00:01<00:09,  9.41it/s]Best trial: 3. Best value: 0.658217:  10%|█         | 10/100 [00:01<00:09,  9.38it/s]                                                                                     Best trial: 3. Best value: 0.658217:  10%|█         | 10/100 [00:01<00:09,  9.38it/s]Best trial: 10. Best value: 0.686604:  10%|█         | 10/100 [00:01<00:09,  9.38it/s]Best trial: 10. Best value: 0.686604:  11%|█         | 11/100 [00:01<00:09,  9.27it/s]                                                                                      Best trial: 10. Best value: 0.686604:  11%|█         | 11/100 [00:01<00:09,  9.27it/s]Best trial: 10. Best value: 0.686604:  11%|█         | 11/100 [00:01<00:09,  9.27it/s]Best trial: 10. Best value: 0.686604:  12%|█▏        | 12/100 [00:01<00:09,  9.27it/s]                                                                                      Best trial: 10. Best value: 0.686604:  12%|█▏        | 12/100 [00:01<00:09,  9.27it/s]Best trial: 10. Best value: 0.686604:  12%|█▏        | 12/100 [00:01<00:09,  9.27it/s]Best trial: 10. Best value: 0.686604:  13%|█▎        | 13/100 [00:01<00:09,  9.23it/s]                                                                                      Best trial: 10. Best value: 0.686604:  13%|█▎        | 13/100 [00:01<00:09,  9.23it/s]Best trial: 10. Best value: 0.686604:  13%|█▎        | 13/100 [00:01<00:09,  9.23it/s]Best trial: 10. Best value: 0.686604:  14%|█▍        | 14/100 [00:01<00:09,  9.20it/s]                                                                                      Best trial: 10. Best value: 0.686604:  14%|█▍        | 14/100 [00:01<00:09,  9.20it/s]Best trial: 10. Best value: 0.686604:  14%|█▍        | 14/100 [00:01<00:09,  9.20it/s]Best trial: 10. Best value: 0.686604:  15%|█▌        | 15/100 [00:01<00:09,  9.00it/s]                                                                                      Best trial: 10. Best value: 0.686604:  15%|█▌        | 15/100 [00:01<00:09,  9.00it/s]Best trial: 10. Best value: 0.686604:  15%|█▌        | 15/100 [00:01<00:09,  9.00it/s]Best trial: 10. Best value: 0.686604:  16%|█▌        | 16/100 [00:01<00:09,  9.08it/s]                                                                                      Best trial: 10. Best value: 0.686604:  16%|█▌        | 16/100 [00:01<00:09,  9.08it/s]Best trial: 10. Best value: 0.686604:  16%|█▌        | 16/100 [00:01<00:09,  9.08it/s]Best trial: 10. Best value: 0.686604:  17%|█▋        | 17/100 [00:01<00:09,  9.13it/s]                                                                                      Best trial: 10. Best value: 0.686604:  17%|█▋        | 17/100 [00:01<00:09,  9.13it/s]Best trial: 10. Best value: 0.686604:  17%|█▋        | 17/100 [00:01<00:09,  9.13it/s]Best trial: 10. Best value: 0.686604:  18%|█▊        | 18/100 [00:01<00:08,  9.17it/s]                                                                                      Best trial: 10. Best value: 0.686604:  18%|█▊        | 18/100 [00:02<00:08,  9.17it/s]Best trial: 10. Best value: 0.686604:  18%|█▊        | 18/100 [00:02<00:08,  9.17it/s]Best trial: 10. Best value: 0.686604:  19%|█▉        | 19/100 [00:02<00:08,  9.20it/s]                                                                                      Best trial: 10. Best value: 0.686604:  19%|█▉        | 19/100 [00:02<00:08,  9.20it/s]Best trial: 10. Best value: 0.686604:  19%|█▉        | 19/100 [00:02<00:08,  9.20it/s]Best trial: 10. Best value: 0.686604:  20%|██        | 20/100 [00:02<00:08,  9.24it/s]                                                                                      Best trial: 10. Best value: 0.686604:  20%|██        | 20/100 [00:02<00:08,  9.24it/s]Best trial: 10. Best value: 0.686604:  20%|██        | 20/100 [00:02<00:08,  9.24it/s]Best trial: 10. Best value: 0.686604:  21%|██        | 21/100 [00:02<00:08,  9.29it/s]                                                                                      Best trial: 10. Best value: 0.686604:  21%|██        | 21/100 [00:02<00:08,  9.29it/s]Best trial: 10. Best value: 0.686604:  21%|██        | 21/100 [00:02<00:08,  9.29it/s]Best trial: 10. Best value: 0.686604:  22%|██▏       | 22/100 [00:02<00:08,  9.32it/s]                                                                                      Best trial: 10. Best value: 0.686604:  22%|██▏       | 22/100 [00:02<00:08,  9.32it/s]Best trial: 10. Best value: 0.686604:  22%|██▏       | 22/100 [00:02<00:08,  9.32it/s]Best trial: 10. Best value: 0.686604:  23%|██▎       | 23/100 [00:02<00:08,  9.33it/s]                                                                                      Best trial: 10. Best value: 0.686604:  23%|██▎       | 23/100 [00:02<00:08,  9.33it/s]Best trial: 10. Best value: 0.686604:  23%|██▎       | 23/100 [00:02<00:08,  9.33it/s]Best trial: 10. Best value: 0.686604:  24%|██▍       | 24/100 [00:02<00:08,  9.28it/s]                                                                                      Best trial: 10. Best value: 0.686604:  24%|██▍       | 24/100 [00:02<00:08,  9.28it/s]Best trial: 10. Best value: 0.686604:  24%|██▍       | 24/100 [00:02<00:08,  9.28it/s]Best trial: 10. Best value: 0.686604:  25%|██▌       | 25/100 [00:02<00:08,  9.28it/s]                                                                                      Best trial: 10. Best value: 0.686604:  25%|██▌       | 25/100 [00:02<00:08,  9.28it/s]Best trial: 10. Best value: 0.686604:  25%|██▌       | 25/100 [00:02<00:08,  9.28it/s]Best trial: 10. Best value: 0.686604:  26%|██▌       | 26/100 [00:02<00:07,  9.29it/s]                                                                                      Best trial: 10. Best value: 0.686604:  26%|██▌       | 26/100 [00:02<00:07,  9.29it/s]Best trial: 10. Best value: 0.686604:  26%|██▌       | 26/100 [00:02<00:07,  9.29it/s]Best trial: 10. Best value: 0.686604:  27%|██▋       | 27/100 [00:02<00:07,  9.29it/s]                                                                                      Best trial: 10. Best value: 0.686604:  27%|██▋       | 27/100 [00:03<00:07,  9.29it/s]Best trial: 10. Best value: 0.686604:  27%|██▋       | 27/100 [00:03<00:07,  9.29it/s]Best trial: 10. Best value: 0.686604:  28%|██▊       | 28/100 [00:03<00:07,  9.32it/s]                                                                                      Best trial: 10. Best value: 0.686604:  28%|██▊       | 28/100 [00:03<00:07,  9.32it/s]Best trial: 10. Best value: 0.686604:  28%|██▊       | 28/100 [00:03<00:07,  9.32it/s]Best trial: 10. Best value: 0.686604:  29%|██▉       | 29/100 [00:03<00:07,  9.33it/s]                                                                                      Best trial: 10. Best value: 0.686604:  29%|██▉       | 29/100 [00:03<00:07,  9.33it/s]Best trial: 10. Best value: 0.686604:  29%|██▉       | 29/100 [00:03<00:07,  9.33it/s]Best trial: 10. Best value: 0.686604:  30%|███       | 30/100 [00:03<00:07,  9.32it/s]                                                                                      Best trial: 10. Best value: 0.686604:  30%|███       | 30/100 [00:03<00:07,  9.32it/s]Best trial: 10. Best value: 0.686604:  30%|███       | 30/100 [00:03<00:07,  9.32it/s]Best trial: 10. Best value: 0.686604:  31%|███       | 31/100 [00:03<00:07,  9.33it/s]                                                                                      Best trial: 10. Best value: 0.686604:  31%|███       | 31/100 [00:03<00:07,  9.33it/s]Best trial: 10. Best value: 0.686604:  31%|███       | 31/100 [00:03<00:07,  9.33it/s]Best trial: 10. Best value: 0.686604:  32%|███▏      | 32/100 [00:03<00:07,  9.36it/s]                                                                                      Best trial: 10. Best value: 0.686604:  32%|███▏      | 32/100 [00:03<00:07,  9.36it/s]Best trial: 10. Best value: 0.686604:  32%|███▏      | 32/100 [00:03<00:07,  9.36it/s]Best trial: 10. Best value: 0.686604:  33%|███▎      | 33/100 [00:03<00:07,  9.35it/s]                                                                                      Best trial: 10. Best value: 0.686604:  33%|███▎      | 33/100 [00:03<00:07,  9.35it/s]Best trial: 10. Best value: 0.686604:  33%|███▎      | 33/100 [00:03<00:07,  9.35it/s]Best trial: 10. Best value: 0.686604:  34%|███▍      | 34/100 [00:03<00:07,  9.34it/s]                                                                                      Best trial: 10. Best value: 0.686604:  34%|███▍      | 34/100 [00:03<00:07,  9.34it/s]Best trial: 10. Best value: 0.686604:  34%|███▍      | 34/100 [00:03<00:07,  9.34it/s]Best trial: 10. Best value: 0.686604:  35%|███▌      | 35/100 [00:03<00:06,  9.34it/s]                                                                                      Best trial: 10. Best value: 0.686604:  35%|███▌      | 35/100 [00:03<00:06,  9.34it/s]Best trial: 10. Best value: 0.686604:  35%|███▌      | 35/100 [00:03<00:06,  9.34it/s]Best trial: 10. Best value: 0.686604:  36%|███▌      | 36/100 [00:03<00:06,  9.28it/s]                                                                                      Best trial: 10. Best value: 0.686604:  36%|███▌      | 36/100 [00:03<00:06,  9.28it/s]Best trial: 10. Best value: 0.686604:  36%|███▌      | 36/100 [00:03<00:06,  9.28it/s]Best trial: 10. Best value: 0.686604:  37%|███▋      | 37/100 [00:03<00:06,  9.08it/s]                                                                                      Best trial: 10. Best value: 0.686604:  37%|███▋      | 37/100 [00:04<00:06,  9.08it/s]Best trial: 10. Best value: 0.686604:  37%|███▋      | 37/100 [00:04<00:06,  9.08it/s]Best trial: 10. Best value: 0.686604:  38%|███▊      | 38/100 [00:04<00:06,  9.11it/s]                                                                                      Best trial: 10. Best value: 0.686604:  38%|███▊      | 38/100 [00:04<00:06,  9.11it/s]Best trial: 10. Best value: 0.686604:  38%|███▊      | 38/100 [00:04<00:06,  9.11it/s]Best trial: 10. Best value: 0.686604:  39%|███▉      | 39/100 [00:04<00:06,  9.14it/s]                                                                                      Best trial: 10. Best value: 0.686604:  39%|███▉      | 39/100 [00:04<00:06,  9.14it/s]Best trial: 10. Best value: 0.686604:  39%|███▉      | 39/100 [00:04<00:06,  9.14it/s]Best trial: 10. Best value: 0.686604:  40%|████      | 40/100 [00:04<00:06,  9.19it/s]                                                                                      Best trial: 10. Best value: 0.686604:  40%|████      | 40/100 [00:04<00:06,  9.19it/s]Best trial: 10. Best value: 0.686604:  40%|████      | 40/100 [00:04<00:06,  9.19it/s]Best trial: 10. Best value: 0.686604:  41%|████      | 41/100 [00:04<00:06,  9.24it/s]                                                                                      Best trial: 10. Best value: 0.686604:  41%|████      | 41/100 [00:04<00:06,  9.24it/s]Best trial: 10. Best value: 0.686604:  41%|████      | 41/100 [00:04<00:06,  9.24it/s]Best trial: 10. Best value: 0.686604:  42%|████▏     | 42/100 [00:04<00:06,  9.23it/s]                                                                                      Best trial: 10. Best value: 0.686604:  42%|████▏     | 42/100 [00:04<00:06,  9.23it/s]Best trial: 10. Best value: 0.686604:  42%|████▏     | 42/100 [00:04<00:06,  9.23it/s]Best trial: 10. Best value: 0.686604:  43%|████▎     | 43/100 [00:04<00:06,  9.17it/s]                                                                                      Best trial: 10. Best value: 0.686604:  43%|████▎     | 43/100 [00:04<00:06,  9.17it/s]Best trial: 10. Best value: 0.686604:  43%|████▎     | 43/100 [00:04<00:06,  9.17it/s]Best trial: 10. Best value: 0.686604:  44%|████▍     | 44/100 [00:04<00:06,  9.20it/s]                                                                                      Best trial: 10. Best value: 0.686604:  44%|████▍     | 44/100 [00:04<00:06,  9.20it/s]Best trial: 10. Best value: 0.686604:  44%|████▍     | 44/100 [00:04<00:06,  9.20it/s]Best trial: 10. Best value: 0.686604:  45%|████▌     | 45/100 [00:04<00:05,  9.23it/s]                                                                                      Best trial: 10. Best value: 0.686604:  45%|████▌     | 45/100 [00:04<00:05,  9.23it/s]Best trial: 10. Best value: 0.686604:  45%|████▌     | 45/100 [00:04<00:05,  9.23it/s]Best trial: 10. Best value: 0.686604:  46%|████▌     | 46/100 [00:04<00:05,  9.23it/s]                                                                                      Best trial: 10. Best value: 0.686604:  46%|████▌     | 46/100 [00:05<00:05,  9.23it/s]Best trial: 10. Best value: 0.686604:  46%|████▌     | 46/100 [00:05<00:05,  9.23it/s]Best trial: 10. Best value: 0.686604:  47%|████▋     | 47/100 [00:05<00:05,  9.25it/s]                                                                                      Trial   0: Return=108.12% | Sharpe=1.03 | MDD=11.98% | Trades=30 | Score=0.6044 | Params: pos=0.80, trail=0.30, stop=0.20
[I 2025-10-17 17:27:17,129] Trial 0 finished with value: 0.604365679824856 and parameters: {'position_fraction': 0.7999999999999999, 'trailing_stop_pct': 0.3, 'stop_loss_pct': 0.2}. Best is trial 0 with value: 0.604365679824856.
Trial   1: Return=116.88% | Sharpe=1.03 | MDD=12.67% | Trades=30 | Score=0.6308 | Params: pos=0.85, trail=0.15, stop=0.10
[I 2025-10-17 17:27:17,237] Trial 1 finished with value: 0.6308089478454886 and parameters: {'position_fraction': 0.85, 'trailing_stop_pct': 0.15, 'stop_loss_pct': 0.1}. Best is trial 1 with value: 0.6308089478454886.
Trial   2: Return= 91.36% | Sharpe=1.02 | MDD=10.58% | Trades=30 | Score=0.5543 | Params: pos=0.70, trail=0.30, stop=0.20
[I 2025-10-17 17:27:17,343] Trial 2 finished with value: 0.5543112388671698 and parameters: {'position_fraction': 0.7, 'trailing_stop_pct': 0.3, 'stop_loss_pct': 0.2}. Best is trial 1 with value: 0.6308089478454886.
Trial   3: Return=125.91% | Sharpe=1.03 | MDD=13.36% | Trades=30 | Score=0.6582 | Params: pos=0.90, trail=0.15, stop=0.25
[I 2025-10-17 17:27:17,448] Trial 3 finished with value: 0.6582165814094908 and parameters: {'position_fraction': 0.8999999999999999, 'trailing_stop_pct': 0.15, 'stop_loss_pct': 0.25}. Best is trial 3 with value: 0.6582165814094908.
Trial   4: Return=125.91% | Sharpe=1.03 | MDD=13.36% | Trades=30 | Score=0.6582 | Params: pos=0.90, trail=0.15, stop=0.10
[I 2025-10-17 17:27:17,555] Trial 4 finished with value: 0.6582165814094908 and parameters: {'position_fraction': 0.8999999999999999, 'trailing_stop_pct': 0.15, 'stop_loss_pct': 0.1}. Best is trial 3 with value: 0.6582165814094908.
Trial   5: Return= 99.61% | Sharpe=1.03 | MDD=11.29% | Trades=30 | Score=0.5789 | Params: pos=0.75, trail=0.20, stop=0.20
[I 2025-10-17 17:27:17,663] Trial 5 finished with value: 0.5788715317642358 and parameters: {'position_fraction': 0.75, 'trailing_stop_pct': 0.2, 'stop_loss_pct': 0.2}. Best is trial 3 with value: 0.6582165814094908.
Trial   6: Return=108.12% | Sharpe=1.03 | MDD=11.98% | Trades=30 | Score=0.6044 | Params: pos=0.80, trail=0.20, stop=0.20
[I 2025-10-17 17:27:17,768] Trial 6 finished with value: 0.604365679824856 and parameters: {'position_fraction': 0.7999999999999999, 'trailing_stop_pct': 0.2, 'stop_loss_pct': 0.2}. Best is trial 3 with value: 0.6582165814094908.
Trial   7: Return= 91.36% | Sharpe=1.02 | MDD=10.58% | Trades=30 | Score=0.5543 | Params: pos=0.70, trail=0.20, stop=0.15
[I 2025-10-17 17:27:17,873] Trial 7 finished with value: 0.5543112388671698 and parameters: {'position_fraction': 0.7, 'trailing_stop_pct': 0.2, 'stop_loss_pct': 0.15000000000000002}. Best is trial 3 with value: 0.6582165814094908.
Trial   8: Return=108.12% | Sharpe=1.03 | MDD=11.98% | Trades=30 | Score=0.6044 | Params: pos=0.80, trail=0.30, stop=0.10
[I 2025-10-17 17:27:17,980] Trial 8 finished with value: 0.604365679824856 and parameters: {'position_fraction': 0.7999999999999999, 'trailing_stop_pct': 0.3, 'stop_loss_pct': 0.1}. Best is trial 3 with value: 0.6582165814094908.
Trial   9: Return=116.88% | Sharpe=1.03 | MDD=12.67% | Trades=30 | Score=0.6308 | Params: pos=0.85, trail=0.25, stop=0.10
[I 2025-10-17 17:27:18,087] Trial 9 finished with value: 0.6308089478454886 and parameters: {'position_fraction': 0.85, 'trailing_stop_pct': 0.25, 'stop_loss_pct': 0.1}. Best is trial 3 with value: 0.6582165814094908.
Trial  10: Return=135.20% | Sharpe=1.03 | MDD=14.04% | Trades=30 | Score=0.6866 | Params: pos=0.95, trail=0.15, stop=0.25
[I 2025-10-17 17:27:18,198] Trial 10 finished with value: 0.686603799313812 and parameters: {'position_fraction': 0.95, 'trailing_stop_pct': 0.15, 'stop_loss_pct': 0.25}. Best is trial 10 with value: 0.686603799313812.
Trial  11: Return=135.20% | Sharpe=1.03 | MDD=14.04% | Trades=30 | Score=0.6866 | Params: pos=0.95, trail=0.15, stop=0.25
[I 2025-10-17 17:27:18,306] Trial 11 finished with value: 0.686603799313812 and parameters: {'position_fraction': 0.95, 'trailing_stop_pct': 0.15, 'stop_loss_pct': 0.25}. Best is trial 10 with value: 0.686603799313812.
Trial  12: Return=135.20% | Sharpe=1.03 | MDD=14.04% | Trades=30 | Score=0.6866 | Params: pos=0.95, trail=0.15, stop=0.25
[I 2025-10-17 17:27:18,415] Trial 12 finished with value: 0.686603799313812 and parameters: {'position_fraction': 0.95, 'trailing_stop_pct': 0.15, 'stop_loss_pct': 0.25}. Best is trial 10 with value: 0.686603799313812.
Trial  13: Return=135.20% | Sharpe=1.03 | MDD=14.04% | Trades=30 | Score=0.6866 | Params: pos=0.95, trail=0.25, stop=0.25
[I 2025-10-17 17:27:18,525] Trial 13 finished with value: 0.686603799313812 and parameters: {'position_fraction': 0.95, 'trailing_stop_pct': 0.25, 'stop_loss_pct': 0.25}. Best is trial 10 with value: 0.686603799313812.
Trial  14: Return=135.20% | Sharpe=1.03 | MDD=14.04% | Trades=30 | Score=0.6866 | Params: pos=0.95, trail=0.20, stop=0.25
[I 2025-10-17 17:27:18,641] Trial 14 finished with value: 0.686603799313812 and parameters: {'position_fraction': 0.95, 'trailing_stop_pct': 0.2, 'stop_loss_pct': 0.25}. Best is trial 10 with value: 0.686603799313812.
Trial  15: Return=125.91% | Sharpe=1.03 | MDD=13.36% | Trades=30 | Score=0.6582 | Params: pos=0.90, trail=0.15, stop=0.15
[I 2025-10-17 17:27:18,749] Trial 15 finished with value: 0.6582165814094908 and parameters: {'position_fraction': 0.8999999999999999, 'trailing_stop_pct': 0.15, 'stop_loss_pct': 0.15000000000000002}. Best is trial 10 with value: 0.686603799313812.
Trial  16: Return=125.91% | Sharpe=1.03 | MDD=13.36% | Trades=30 | Score=0.6582 | Params: pos=0.90, trail=0.15, stop=0.25
[I 2025-10-17 17:27:18,858] Trial 16 finished with value: 0.6582165814094908 and parameters: {'position_fraction': 0.8999999999999999, 'trailing_stop_pct': 0.15, 'stop_loss_pct': 0.25}. Best is trial 10 with value: 0.686603799313812.
Trial  17: Return=135.20% | Sharpe=1.03 | MDD=14.04% | Trades=30 | Score=0.6866 | Params: pos=0.95, trail=0.25, stop=0.25
[I 2025-10-17 17:27:18,966] Trial 17 finished with value: 0.686603799313812 and parameters: {'position_fraction': 0.95, 'trailing_stop_pct': 0.25, 'stop_loss_pct': 0.25}. Best is trial 10 with value: 0.686603799313812.
Trial  18: Return=116.88% | Sharpe=1.03 | MDD=12.67% | Trades=30 | Score=0.6308 | Params: pos=0.85, trail=0.20, stop=0.15
[I 2025-10-17 17:27:19,073] Trial 18 finished with value: 0.6308089478454886 and parameters: {'position_fraction': 0.85, 'trailing_stop_pct': 0.2, 'stop_loss_pct': 0.15000000000000002}. Best is trial 10 with value: 0.686603799313812.
Trial  19: Return=135.20% | Sharpe=1.03 | MDD=14.04% | Trades=30 | Score=0.6866 | Params: pos=0.95, trail=0.15, stop=0.20
[I 2025-10-17 17:27:19,180] Trial 19 finished with value: 0.686603799313812 and parameters: {'position_fraction': 0.95, 'trailing_stop_pct': 0.15, 'stop_loss_pct': 0.2}. Best is trial 10 with value: 0.686603799313812.
Trial  20: Return=125.91% | Sharpe=1.03 | MDD=13.36% | Trades=30 | Score=0.6582 | Params: pos=0.90, trail=0.20, stop=0.25
[I 2025-10-17 17:27:19,287] Trial 20 finished with value: 0.6582165814094908 and parameters: {'position_fraction': 0.8999999999999999, 'trailing_stop_pct': 0.2, 'stop_loss_pct': 0.25}. Best is trial 10 with value: 0.686603799313812.
Trial  21: Return=135.20% | Sharpe=1.03 | MDD=14.04% | Trades=30 | Score=0.6866 | Params: pos=0.95, trail=0.15, stop=0.25
[I 2025-10-17 17:27:19,393] Trial 21 finished with value: 0.686603799313812 and parameters: {'position_fraction': 0.95, 'trailing_stop_pct': 0.15, 'stop_loss_pct': 0.25}. Best is trial 10 with value: 0.686603799313812.
Trial  22: Return=135.20% | Sharpe=1.03 | MDD=14.04% | Trades=30 | Score=0.6866 | Params: pos=0.95, trail=0.15, stop=0.25
[I 2025-10-17 17:27:19,500] Trial 22 finished with value: 0.686603799313812 and parameters: {'position_fraction': 0.95, 'trailing_stop_pct': 0.15, 'stop_loss_pct': 0.25}. Best is trial 10 with value: 0.686603799313812.
Trial  23: Return=125.91% | Sharpe=1.03 | MDD=13.36% | Trades=30 | Score=0.6582 | Params: pos=0.90, trail=0.15, stop=0.20
[I 2025-10-17 17:27:19,609] Trial 23 finished with value: 0.6582165814094908 and parameters: {'position_fraction': 0.8999999999999999, 'trailing_stop_pct': 0.15, 'stop_loss_pct': 0.2}. Best is trial 10 with value: 0.686603799313812.Best trial: 10. Best value: 0.686604:  47%|████▋     | 47/100 [00:05<00:05,  9.25it/s]Best trial: 10. Best value: 0.686604:  47%|████▋     | 47/100 [00:05<00:05,  9.25it/s]Best trial: 10. Best value: 0.686604:  48%|████▊     | 48/100 [00:05<00:05,  9.24it/s]                                                                                      Best trial: 10. Best value: 0.686604:  48%|████▊     | 48/100 [00:05<00:05,  9.24it/s]Best trial: 10. Best value: 0.686604:  48%|████▊     | 48/100 [00:05<00:05,  9.24it/s]Best trial: 10. Best value: 0.686604:  49%|████▉     | 49/100 [00:05<00:05,  9.25it/s]                                                                                      Best trial: 10. Best value: 0.686604:  49%|████▉     | 49/100 [00:05<00:05,  9.25it/s]Best trial: 10. Best value: 0.686604:  49%|████▉     | 49/100 [00:05<00:05,  9.25it/s]Best trial: 10. Best value: 0.686604:  50%|█████     | 50/100 [00:05<00:05,  9.25it/s]                                                                                      Best trial: 10. Best value: 0.686604:  50%|█████     | 50/100 [00:05<00:05,  9.25it/s]Best trial: 10. Best value: 0.686604:  50%|█████     | 50/100 [00:05<00:05,  9.25it/s]Best trial: 10. Best value: 0.686604:  51%|█████     | 51/100 [00:05<00:05,  9.27it/s]                                                                                      Best trial: 10. Best value: 0.686604:  51%|█████     | 51/100 [00:05<00:05,  9.27it/s]Best trial: 10. Best value: 0.686604:  51%|█████     | 51/100 [00:05<00:05,  9.27it/s]Best trial: 10. Best value: 0.686604:  52%|█████▏    | 52/100 [00:05<00:05,  9.24it/s]                                                                                      Best trial: 10. Best value: 0.686604:  52%|█████▏    | 52/100 [00:05<00:05,  9.24it/s]Best trial: 10. Best value: 0.686604:  52%|█████▏    | 52/100 [00:05<00:05,  9.24it/s]Best trial: 10. Best value: 0.686604:  53%|█████▎    | 53/100 [00:05<00:05,  9.17it/s]                                                                                      Best trial: 10. Best value: 0.686604:  53%|█████▎    | 53/100 [00:05<00:05,  9.17it/s]Best trial: 10. Best value: 0.686604:  53%|█████▎    | 53/100 [00:05<00:05,  9.17it/s]Best trial: 10. Best value: 0.686604:  54%|█████▍    | 54/100 [00:05<00:04,  9.23it/s]                                                                                      Best trial: 10. Best value: 0.686604:  54%|█████▍    | 54/100 [00:05<00:04,  9.23it/s]Best trial: 10. Best value: 0.686604:  54%|█████▍    | 54/100 [00:05<00:04,  9.23it/s]Best trial: 10. Best value: 0.686604:  55%|█████▌    | 55/100 [00:05<00:04,  9.25it/s]                                                                                      Best trial: 10. Best value: 0.686604:  55%|█████▌    | 55/100 [00:06<00:04,  9.25it/s]Best trial: 10. Best value: 0.686604:  55%|█████▌    | 55/100 [00:06<00:04,  9.25it/s]Best trial: 10. Best value: 0.686604:  56%|█████▌    | 56/100 [00:06<00:04,  9.25it/s]                                                                                      Best trial: 10. Best value: 0.686604:  56%|█████▌    | 56/100 [00:06<00:04,  9.25it/s]Best trial: 10. Best value: 0.686604:  56%|█████▌    | 56/100 [00:06<00:04,  9.25it/s]Best trial: 10. Best value: 0.686604:  57%|█████▋    | 57/100 [00:06<00:04,  9.27it/s]                                                                                      Best trial: 10. Best value: 0.686604:  57%|█████▋    | 57/100 [00:06<00:04,  9.27it/s]Best trial: 10. Best value: 0.686604:  57%|█████▋    | 57/100 [00:06<00:04,  9.27it/s]Best trial: 10. Best value: 0.686604:  58%|█████▊    | 58/100 [00:06<00:04,  9.15it/s]                                                                                      Best trial: 10. Best value: 0.686604:  58%|█████▊    | 58/100 [00:06<00:04,  9.15it/s]Best trial: 10. Best value: 0.686604:  58%|█████▊    | 58/100 [00:06<00:04,  9.15it/s]Best trial: 10. Best value: 0.686604:  59%|█████▉    | 59/100 [00:06<00:04,  8.96it/s]                                                                                      Best trial: 10. Best value: 0.686604:  59%|█████▉    | 59/100 [00:06<00:04,  8.96it/s]Best trial: 10. Best value: 0.686604:  59%|█████▉    | 59/100 [00:06<00:04,  8.96it/s]Best trial: 10. Best value: 0.686604:  60%|██████    | 60/100 [00:06<00:04,  8.84it/s]                                                                                      Best trial: 10. Best value: 0.686604:  60%|██████    | 60/100 [00:06<00:04,  8.84it/s]Best trial: 10. Best value: 0.686604:  60%|██████    | 60/100 [00:06<00:04,  8.84it/s]Best trial: 10. Best value: 0.686604:  61%|██████    | 61/100 [00:06<00:04,  8.95it/s]                                                                                      Best trial: 10. Best value: 0.686604:  61%|██████    | 61/100 [00:06<00:04,  8.95it/s]Best trial: 10. Best value: 0.686604:  61%|██████    | 61/100 [00:06<00:04,  8.95it/s]Best trial: 10. Best value: 0.686604:  62%|██████▏   | 62/100 [00:06<00:04,  9.01it/s]                                                                                      Best trial: 10. Best value: 0.686604:  62%|██████▏   | 62/100 [00:06<00:04,  9.01it/s]Best trial: 10. Best value: 0.686604:  62%|██████▏   | 62/100 [00:06<00:04,  9.01it/s]Best trial: 10. Best value: 0.686604:  63%|██████▎   | 63/100 [00:06<00:04,  9.09it/s]                                                                                      Best trial: 10. Best value: 0.686604:  63%|██████▎   | 63/100 [00:06<00:04,  9.09it/s]Best trial: 10. Best value: 0.686604:  63%|██████▎   | 63/100 [00:06<00:04,  9.09it/s]Best trial: 10. Best value: 0.686604:  64%|██████▍   | 64/100 [00:06<00:03,  9.12it/s]                                                                                      Best trial: 10. Best value: 0.686604:  64%|██████▍   | 64/100 [00:07<00:03,  9.12it/s]Best trial: 10. Best value: 0.686604:  64%|██████▍   | 64/100 [00:07<00:03,  9.12it/s]Best trial: 10. Best value: 0.686604:  65%|██████▌   | 65/100 [00:07<00:03,  9.15it/s]                                                                                      Best trial: 10. Best value: 0.686604:  65%|██████▌   | 65/100 [00:07<00:03,  9.15it/s]Best trial: 10. Best value: 0.686604:  65%|██████▌   | 65/100 [00:07<00:03,  9.15it/s]Best trial: 10. Best value: 0.686604:  66%|██████▌   | 66/100 [00:07<00:03,  9.19it/s]                                                                                      Best trial: 10. Best value: 0.686604:  66%|██████▌   | 66/100 [00:07<00:03,  9.19it/s]Best trial: 10. Best value: 0.686604:  66%|██████▌   | 66/100 [00:07<00:03,  9.19it/s]Best trial: 10. Best value: 0.686604:  67%|██████▋   | 67/100 [00:07<00:03,  9.22it/s]                                                                                      Best trial: 10. Best value: 0.686604:  67%|██████▋   | 67/100 [00:07<00:03,  9.22it/s]Best trial: 10. Best value: 0.686604:  67%|██████▋   | 67/100 [00:07<00:03,  9.22it/s]Best trial: 10. Best value: 0.686604:  68%|██████▊   | 68/100 [00:07<00:03,  9.25it/s]                                                                                      Best trial: 10. Best value: 0.686604:  68%|██████▊   | 68/100 [00:07<00:03,  9.25it/s]Best trial: 10. Best value: 0.686604:  68%|██████▊   | 68/100 [00:07<00:03,  9.25it/s]Best trial: 10. Best value: 0.686604:  69%|██████▉   | 69/100 [00:07<00:03,  9.26it/s]                                                                                      Best trial: 10. Best value: 0.686604:  69%|██████▉   | 69/100 [00:07<00:03,  9.26it/s]Best trial: 10. Best value: 0.686604:  69%|██████▉   | 69/100 [00:07<00:03,  9.26it/s]Best trial: 10. Best value: 0.686604:  70%|███████   | 70/100 [00:07<00:03,  9.25it/s]                                                                                      Best trial: 10. Best value: 0.686604:  70%|███████   | 70/100 [00:07<00:03,  9.25it/s]Best trial: 10. Best value: 0.686604:  70%|███████   | 70/100 [00:07<00:03,  9.25it/s]Best trial: 10. Best value: 0.686604:  71%|███████   | 71/100 [00:07<00:03,  8.60it/s]                                                                                      
Trial  24: Return=135.20% | Sharpe=1.03 | MDD=14.04% | Trades=30 | Score=0.6866 | Params: pos=0.95, trail=0.15, stop=0.25
[I 2025-10-17 17:27:19,717] Trial 24 finished with value: 0.686603799313812 and parameters: {'position_fraction': 0.95, 'trailing_stop_pct': 0.15, 'stop_loss_pct': 0.25}. Best is trial 10 with value: 0.686603799313812.
Trial  25: Return=125.91% | Sharpe=1.03 | MDD=13.36% | Trades=30 | Score=0.6582 | Params: pos=0.90, trail=0.20, stop=0.25
[I 2025-10-17 17:27:19,824] Trial 25 finished with value: 0.6582165814094908 and parameters: {'position_fraction': 0.8999999999999999, 'trailing_stop_pct': 0.2, 'stop_loss_pct': 0.25}. Best is trial 10 with value: 0.686603799313812.
Trial  26: Return=135.20% | Sharpe=1.03 | MDD=14.04% | Trades=30 | Score=0.6866 | Params: pos=0.95, trail=0.15, stop=0.20
[I 2025-10-17 17:27:19,932] Trial 26 finished with value: 0.686603799313812 and parameters: {'position_fraction': 0.95, 'trailing_stop_pct': 0.15, 'stop_loss_pct': 0.2}. Best is trial 10 with value: 0.686603799313812.
Trial  27: Return=116.88% | Sharpe=1.03 | MDD=12.67% | Trades=30 | Score=0.6308 | Params: pos=0.85, trail=0.20, stop=0.25
[I 2025-10-17 17:27:20,038] Trial 27 finished with value: 0.6308089478454886 and parameters: {'position_fraction': 0.85, 'trailing_stop_pct': 0.2, 'stop_loss_pct': 0.25}. Best is trial 10 with value: 0.686603799313812.
Trial  28: Return= 99.61% | Sharpe=1.03 | MDD=11.29% | Trades=30 | Score=0.5789 | Params: pos=0.75, trail=0.15, stop=0.20
[I 2025-10-17 17:27:20,145] Trial 28 finished with value: 0.5788715317642358 and parameters: {'position_fraction': 0.75, 'trailing_stop_pct': 0.15, 'stop_loss_pct': 0.2}. Best is trial 10 with value: 0.686603799313812.
Trial  29: Return=135.20% | Sharpe=1.03 | MDD=14.04% | Trades=30 | Score=0.6866 | Params: pos=0.95, trail=0.25, stop=0.25
[I 2025-10-17 17:27:20,253] Trial 29 finished with value: 0.686603799313812 and parameters: {'position_fraction': 0.95, 'trailing_stop_pct': 0.25, 'stop_loss_pct': 0.25}. Best is trial 10 with value: 0.686603799313812.
Trial  30: Return=125.91% | Sharpe=1.03 | MDD=13.36% | Trades=30 | Score=0.6582 | Params: pos=0.90, trail=0.15, stop=0.20
[I 2025-10-17 17:27:20,360] Trial 30 finished with value: 0.6582165814094908 and parameters: {'position_fraction': 0.8999999999999999, 'trailing_stop_pct': 0.15, 'stop_loss_pct': 0.2}. Best is trial 10 with value: 0.686603799313812.
Trial  31: Return=135.20% | Sharpe=1.03 | MDD=14.04% | Trades=30 | Score=0.6866 | Params: pos=0.95, trail=0.25, stop=0.25
[I 2025-10-17 17:27:20,466] Trial 31 finished with value: 0.686603799313812 and parameters: {'position_fraction': 0.95, 'trailing_stop_pct': 0.25, 'stop_loss_pct': 0.25}. Best is trial 10 with value: 0.686603799313812.
Trial  32: Return=135.20% | Sharpe=1.03 | MDD=14.04% | Trades=30 | Score=0.6866 | Params: pos=0.95, trail=0.25, stop=0.25
[I 2025-10-17 17:27:20,573] Trial 32 finished with value: 0.686603799313812 and parameters: {'position_fraction': 0.95, 'trailing_stop_pct': 0.25, 'stop_loss_pct': 0.25}. Best is trial 10 with value: 0.686603799313812.
Trial  33: Return=135.20% | Sharpe=1.03 | MDD=14.04% | Trades=30 | Score=0.6866 | Params: pos=0.95, trail=0.30, stop=0.25
[I 2025-10-17 17:27:20,681] Trial 33 finished with value: 0.686603799313812 and parameters: {'position_fraction': 0.95, 'trailing_stop_pct': 0.3, 'stop_loss_pct': 0.25}. Best is trial 10 with value: 0.686603799313812.
Trial  34: Return=125.91% | Sharpe=1.03 | MDD=13.36% | Trades=30 | Score=0.6582 | Params: pos=0.90, trail=0.25, stop=0.25
[I 2025-10-17 17:27:20,788] Trial 34 finished with value: 0.6582165814094908 and parameters: {'position_fraction': 0.8999999999999999, 'trailing_stop_pct': 0.25, 'stop_loss_pct': 0.25}. Best is trial 10 with value: 0.686603799313812.
Trial  35: Return=116.88% | Sharpe=1.03 | MDD=12.67% | Trades=30 | Score=0.6308 | Params: pos=0.85, trail=0.30, stop=0.25
[I 2025-10-17 17:27:20,897] Trial 35 finished with value: 0.6308089478454886 and parameters: {'position_fraction': 0.85, 'trailing_stop_pct': 0.3, 'stop_loss_pct': 0.25}. Best is trial 10 with value: 0.686603799313812.
Trial  36: Return=135.20% | Sharpe=1.03 | MDD=14.04% | Trades=30 | Score=0.6866 | Params: pos=0.95, trail=0.15, stop=0.20
[I 2025-10-17 17:27:21,013] Trial 36 finished with value: 0.686603799313812 and parameters: {'position_fraction': 0.95, 'trailing_stop_pct': 0.15, 'stop_loss_pct': 0.2}. Best is trial 10 with value: 0.686603799313812.
Trial  37: Return=125.91% | Sharpe=1.03 | MDD=13.36% | Trades=30 | Score=0.6582 | Params: pos=0.90, trail=0.20, stop=0.25
[I 2025-10-17 17:27:21,122] Trial 37 finished with value: 0.6582165814094908 and parameters: {'position_fraction': 0.8999999999999999, 'trailing_stop_pct': 0.2, 'stop_loss_pct': 0.25}. Best is trial 10 with value: 0.686603799313812.
Trial  38: Return= 99.61% | Sharpe=1.03 | MDD=11.29% | Trades=30 | Score=0.5789 | Params: pos=0.75, trail=0.15, stop=0.20
[I 2025-10-17 17:27:21,230] Trial 38 finished with value: 0.5788715317642358 and parameters: {'position_fraction': 0.75, 'trailing_stop_pct': 0.15, 'stop_loss_pct': 0.2}. Best is trial 10 with value: 0.686603799313812.
Trial  39: Return=135.20% | Sharpe=1.03 | MDD=14.04% | Trades=30 | Score=0.6866 | Params: pos=0.95, trail=0.20, stop=0.25
[I 2025-10-17 17:27:21,338] Trial 39 finished with value: 0.686603799313812 and parameters: {'position_fraction': 0.95, 'trailing_stop_pct': 0.2, 'stop_loss_pct': 0.25}. Best is trial 10 with value: 0.686603799313812.
Trial  40: Return=125.91% | Sharpe=1.03 | MDD=13.36% | Trades=30 | Score=0.6582 | Params: pos=0.90, trail=0.25, stop=0.20
[I 2025-10-17 17:27:21,444] Trial 40 finished with value: 0.6582165814094908 and parameters: {'position_fraction': 0.8999999999999999, 'trailing_stop_pct': 0.25, 'stop_loss_pct': 0.2}. Best is trial 10 with value: 0.686603799313812.
Trial  41: Return=135.20% | Sharpe=1.03 | MDD=14.04% | Trades=30 | Score=0.6866 | Params: pos=0.95, trail=0.20, stop=0.25
[I 2025-10-17 17:27:21,553] Trial 41 finished with value: 0.686603799313812 and parameters: {'position_fraction': 0.95, 'trailing_stop_pct': 0.2, 'stop_loss_pct': 0.25}. Best is trial 10 with value: 0.686603799313812.
Trial  42: Return=135.20% | Sharpe=1.03 | MDD=14.04% | Trades=30 | Score=0.6866 | Params: pos=0.95, trail=0.15, stop=0.25
[I 2025-10-17 17:27:21,664] Trial 42 finished with value: 0.686603799313812 and parameters: {'position_fraction': 0.95, 'trailing_stop_pct': 0.15, 'stop_loss_pct': 0.25}. Best is trial 10 with value: 0.686603799313812.
Trial  43: Return=135.20% | Sharpe=1.03 | MDD=14.04% | Trades=30 | Score=0.6866 | Params: pos=0.95, trail=0.20, stop=0.25
[I 2025-10-17 17:27:21,772] Trial 43 finished with value: 0.686603799313812 and parameters: {'position_fraction': 0.95, 'trailing_stop_pct': 0.2, 'stop_loss_pct': 0.25}. Best is trial 10 with value: 0.686603799313812.
Trial  44: Return=125.91% | Sharpe=1.03 | MDD=13.36% | Trades=30 | Score=0.6582 | Params: pos=0.90, trail=0.15, stop=0.25
[I 2025-10-17 17:27:21,879] Trial 44 finished with value: 0.6582165814094908 and parameters: {'position_fraction': 0.8999999999999999, 'trailing_stop_pct': 0.15, 'stop_loss_pct': 0.25}. Best is trial 10 with value: 0.686603799313812.
Trial  45: Return=135.20% | Sharpe=1.03 | MDD=14.04% | Trades=30 | Score=0.6866 | Params: pos=0.95, trail=0.15, stop=0.15
[I 2025-10-17 17:27:21,988] Trial 45 finished with value: 0.686603799313812 and parameters: {'position_fraction': 0.95, 'trailing_stop_pct': 0.15, 'stop_loss_pct': 0.15000000000000002}. Best is trial 10 with value: 0.686603799313812.
Trial  46: Return= 91.36% | Sharpe=1.02 | MDD=10.58% | Trades=30 | Score=0.5543 | Params: pos=0.70, trail=0.25, stop=0.25
[I 2025-10-17 17:27:22,095] Trial 46 finished with value: 0.5543112388671698 and parameters: {'position_fraction': 0.7, 'trailing_stop_pct': 0.25, 'stop_loss_pct': 0.25}. Best is trial 10 with value: 0.686603799313812.
Trial  47: Return=108.12% | Sharpe=1.03 | MDD=11.98% | Trades=30 | Score=0.6044 | Params: pos=0.80, trail=0.20, stop=0.25
[I 2025-10-17 17:27:22,204] Trial 47 finished with value: 0.604365679824856 and parameters: {'position_fraction': 0.7999999999999999, 'trailing_stop_pct': 0.2, 'stop_loss_pct': 0.25}. Best is trial 10 with value: 0.686603799313812.Best trial: 10. Best value: 0.686604:  71%|███████   | 71/100 [00:07<00:03,  8.60it/s]Best trial: 10. Best value: 0.686604:  71%|███████   | 71/100 [00:07<00:03,  8.60it/s]Best trial: 10. Best value: 0.686604:  72%|███████▏  | 72/100 [00:07<00:03,  8.78it/s]                                                                                      Best trial: 10. Best value: 0.686604:  72%|███████▏  | 72/100 [00:07<00:03,  8.78it/s]Best trial: 10. Best value: 0.686604:  72%|███████▏  | 72/100 [00:07<00:03,  8.78it/s]Best trial: 10. Best value: 0.686604:  73%|███████▎  | 73/100 [00:07<00:03,  8.93it/s]                                                                                      Best trial: 10. Best value: 0.686604:  73%|███████▎  | 73/100 [00:08<00:03,  8.93it/s]Best trial: 10. Best value: 0.686604:  73%|███████▎  | 73/100 [00:08<00:03,  8.93it/s]Best trial: 10. Best value: 0.686604:  74%|███████▍  | 74/100 [00:08<00:02,  9.04it/s]                                                                                      Best trial: 10. Best value: 0.686604:  74%|███████▍  | 74/100 [00:08<00:02,  9.04it/s]Best trial: 10. Best value: 0.686604:  74%|███████▍  | 74/100 [00:08<00:02,  9.04it/s]Best trial: 10. Best value: 0.686604:  75%|███████▌  | 75/100 [00:08<00:02,  9.12it/s]                                                                                      Best trial: 10. Best value: 0.686604:  75%|███████▌  | 75/100 [00:08<00:02,  9.12it/s]Best trial: 10. Best value: 0.686604:  75%|███████▌  | 75/100 [00:08<00:02,  9.12it/s]Best trial: 10. Best value: 0.686604:  76%|███████▌  | 76/100 [00:08<00:02,  8.63it/s]                                                                                      Best trial: 10. Best value: 0.686604:  76%|███████▌  | 76/100 [00:08<00:02,  8.63it/s]Best trial: 10. Best value: 0.686604:  76%|███████▌  | 76/100 [00:08<00:02,  8.63it/s]Best trial: 10. Best value: 0.686604:  77%|███████▋  | 77/100 [00:08<00:02,  8.70it/s]                                                                                      Best trial: 10. Best value: 0.686604:  77%|███████▋  | 77/100 [00:08<00:02,  8.70it/s]Best trial: 10. Best value: 0.686604:  77%|███████▋  | 77/100 [00:08<00:02,  8.70it/s]Best trial: 10. Best value: 0.686604:  78%|███████▊  | 78/100 [00:08<00:02,  8.85it/s]                                                                                      Best trial: 10. Best value: 0.686604:  78%|███████▊  | 78/100 [00:08<00:02,  8.85it/s]Best trial: 10. Best value: 0.686604:  78%|███████▊  | 78/100 [00:08<00:02,  8.85it/s]Best trial: 10. Best value: 0.686604:  79%|███████▉  | 79/100 [00:08<00:02,  8.95it/s]                                                                                      Best trial: 10. Best value: 0.686604:  79%|███████▉  | 79/100 [00:08<00:02,  8.95it/s]Best trial: 10. Best value: 0.686604:  79%|███████▉  | 79/100 [00:08<00:02,  8.95it/s]Best trial: 10. Best value: 0.686604:  80%|████████  | 80/100 [00:08<00:02,  9.03it/s]                                                                                      Best trial: 10. Best value: 0.686604:  80%|████████  | 80/100 [00:08<00:02,  9.03it/s]Best trial: 10. Best value: 0.686604:  80%|████████  | 80/100 [00:08<00:02,  9.03it/s]Best trial: 10. Best value: 0.686604:  81%|████████  | 81/100 [00:08<00:02,  9.09it/s]                                                                                      Best trial: 10. Best value: 0.686604:  81%|████████  | 81/100 [00:08<00:02,  9.09it/s]Best trial: 10. Best value: 0.686604:  81%|████████  | 81/100 [00:08<00:02,  9.09it/s]Best trial: 10. Best value: 0.686604:  82%|████████▏ | 82/100 [00:08<00:01,  9.16it/s]                                                                                      Best trial: 10. Best value: 0.686604:  82%|████████▏ | 82/100 [00:09<00:01,  9.16it/s]Best trial: 10. Best value: 0.686604:  82%|████████▏ | 82/100 [00:09<00:01,  9.16it/s]Best trial: 10. Best value: 0.686604:  83%|████████▎ | 83/100 [00:09<00:01,  9.24it/s]                                                                                      Best trial: 10. Best value: 0.686604:  83%|████████▎ | 83/100 [00:09<00:01,  9.24it/s]Best trial: 10. Best value: 0.686604:  83%|████████▎ | 83/100 [00:09<00:01,  9.24it/s]Best trial: 10. Best value: 0.686604:  84%|████████▍ | 84/100 [00:09<00:01,  9.28it/s]                                                                                      Best trial: 10. Best value: 0.686604:  84%|████████▍ | 84/100 [00:09<00:01,  9.28it/s]Best trial: 10. Best value: 0.686604:  84%|████████▍ | 84/100 [00:09<00:01,  9.28it/s]Best trial: 10. Best value: 0.686604:  85%|████████▌ | 85/100 [00:09<00:01,  9.26it/s]                                                                                      Best trial: 10. Best value: 0.686604:  85%|████████▌ | 85/100 [00:09<00:01,  9.26it/s]Best trial: 10. Best value: 0.686604:  85%|████████▌ | 85/100 [00:09<00:01,  9.26it/s]Best trial: 10. Best value: 0.686604:  86%|████████▌ | 86/100 [00:09<00:01,  9.23it/s]                                                                                      Best trial: 10. Best value: 0.686604:  86%|████████▌ | 86/100 [00:09<00:01,  9.23it/s]Best trial: 10. Best value: 0.686604:  86%|████████▌ | 86/100 [00:09<00:01,  9.23it/s]Best trial: 10. Best value: 0.686604:  87%|████████▋ | 87/100 [00:09<00:01,  9.24it/s]                                                                                      Best trial: 10. Best value: 0.686604:  87%|████████▋ | 87/100 [00:09<00:01,  9.24it/s]Best trial: 10. Best value: 0.686604:  87%|████████▋ | 87/100 [00:09<00:01,  9.24it/s]Best trial: 10. Best value: 0.686604:  88%|████████▊ | 88/100 [00:09<00:01,  9.20it/s]                                                                                      Best trial: 10. Best value: 0.686604:  88%|████████▊ | 88/100 [00:09<00:01,  9.20it/s]Best trial: 10. Best value: 0.686604:  88%|████████▊ | 88/100 [00:09<00:01,  9.20it/s]Best trial: 10. Best value: 0.686604:  89%|████████▉ | 89/100 [00:09<00:01,  9.20it/s]                                                                                      Best trial: 10. Best value: 0.686604:  89%|████████▉ | 89/100 [00:09<00:01,  9.20it/s]Best trial: 10. Best value: 0.686604:  89%|████████▉ | 89/100 [00:09<00:01,  9.20it/s]Best trial: 10. Best value: 0.686604:  90%|█████████ | 90/100 [00:09<00:01,  9.19it/s]                                                                                      Best trial: 10. Best value: 0.686604:  90%|█████████ | 90/100 [00:09<00:01,  9.19it/s]Best trial: 10. Best value: 0.686604:  90%|█████████ | 90/100 [00:09<00:01,  9.19it/s]Best trial: 10. Best value: 0.686604:  91%|█████████ | 91/100 [00:09<00:00,  9.18it/s]                                                                                      Best trial: 10. Best value: 0.686604:  91%|█████████ | 91/100 [00:10<00:00,  9.18it/s]Best trial: 10. Best value: 0.686604:  91%|█████████ | 91/100 [00:10<00:00,  9.18it/s]Best trial: 10. Best value: 0.686604:  92%|█████████▏| 92/100 [00:10<00:00,  9.14it/s]                                                                                      Best trial: 10. Best value: 0.686604:  92%|█████████▏| 92/100 [00:10<00:00,  9.14it/s]Best trial: 10. Best value: 0.686604:  92%|█████████▏| 92/100 [00:10<00:00,  9.14it/s]Best trial: 10. Best value: 0.686604:  93%|█████████▎| 93/100 [00:10<00:00,  9.16it/s]                                                                                      Best trial: 10. Best value: 0.686604:  93%|█████████▎| 93/100 [00:10<00:00,  9.16it/s]Best trial: 10. Best value: 0.686604:  93%|█████████▎| 93/100 [00:10<00:00,  9.16it/s]Best trial: 10. Best value: 0.686604:  94%|█████████▍| 94/100 [00:10<00:00,  9.17it/s]                                                                                      Best trial: 10. Best value: 0.686604:  94%|█████████▍| 94/100 [00:10<00:00,  9.17it/s]Best trial: 10. Best value: 0.686604:  94%|█████████▍| 94/100 [00:10<00:00,  9.17it/s]Best trial: 10. Best value: 0.686604:  95%|█████████▌| 95/100 [00:10<00:00,  9.17it/s]                                                                                      
Trial  48: Return=125.91% | Sharpe=1.03 | MDD=13.36% | Trades=30 | Score=0.6582 | Params: pos=0.90, trail=0.15, stop=0.25
[I 2025-10-17 17:27:22,311] Trial 48 finished with value: 0.6582165814094908 and parameters: {'position_fraction': 0.8999999999999999, 'trailing_stop_pct': 0.15, 'stop_loss_pct': 0.25}. Best is trial 10 with value: 0.686603799313812.
Trial  49: Return=135.20% | Sharpe=1.03 | MDD=14.04% | Trades=30 | Score=0.6866 | Params: pos=0.95, trail=0.30, stop=0.15
[I 2025-10-17 17:27:22,420] Trial 49 finished with value: 0.686603799313812 and parameters: {'position_fraction': 0.95, 'trailing_stop_pct': 0.3, 'stop_loss_pct': 0.15000000000000002}. Best is trial 10 with value: 0.686603799313812.
Trial  50: Return=125.91% | Sharpe=1.03 | MDD=13.36% | Trades=30 | Score=0.6582 | Params: pos=0.90, trail=0.20, stop=0.20
[I 2025-10-17 17:27:22,527] Trial 50 finished with value: 0.6582165814094908 and parameters: {'position_fraction': 0.8999999999999999, 'trailing_stop_pct': 0.2, 'stop_loss_pct': 0.2}. Best is trial 10 with value: 0.686603799313812.
Trial  51: Return=135.20% | Sharpe=1.03 | MDD=14.04% | Trades=30 | Score=0.6866 | Params: pos=0.95, trail=0.25, stop=0.25
[I 2025-10-17 17:27:22,636] Trial 51 finished with value: 0.686603799313812 and parameters: {'position_fraction': 0.95, 'trailing_stop_pct': 0.25, 'stop_loss_pct': 0.25}. Best is trial 10 with value: 0.686603799313812.
Trial  52: Return=135.20% | Sharpe=1.03 | MDD=14.04% | Trades=30 | Score=0.6866 | Params: pos=0.95, trail=0.25, stop=0.25
[I 2025-10-17 17:27:22,747] Trial 52 finished with value: 0.686603799313812 and parameters: {'position_fraction': 0.95, 'trailing_stop_pct': 0.25, 'stop_loss_pct': 0.25}. Best is trial 10 with value: 0.686603799313812.
Trial  53: Return=135.20% | Sharpe=1.03 | MDD=14.04% | Trades=30 | Score=0.6866 | Params: pos=0.95, trail=0.25, stop=0.10
[I 2025-10-17 17:27:22,854] Trial 53 finished with value: 0.686603799313812 and parameters: {'position_fraction': 0.95, 'trailing_stop_pct': 0.25, 'stop_loss_pct': 0.1}. Best is trial 10 with value: 0.686603799313812.
Trial  54: Return=135.20% | Sharpe=1.03 | MDD=14.04% | Trades=30 | Score=0.6866 | Params: pos=0.95, trail=0.25, stop=0.25
[I 2025-10-17 17:27:22,961] Trial 54 finished with value: 0.686603799313812 and parameters: {'position_fraction': 0.95, 'trailing_stop_pct': 0.25, 'stop_loss_pct': 0.25}. Best is trial 10 with value: 0.686603799313812.
Trial  55: Return=135.20% | Sharpe=1.03 | MDD=14.04% | Trades=30 | Score=0.6866 | Params: pos=0.95, trail=0.15, stop=0.25
[I 2025-10-17 17:27:23,070] Trial 55 finished with value: 0.686603799313812 and parameters: {'position_fraction': 0.95, 'trailing_stop_pct': 0.15, 'stop_loss_pct': 0.25}. Best is trial 10 with value: 0.686603799313812.
Trial  56: Return=135.20% | Sharpe=1.03 | MDD=14.04% | Trades=30 | Score=0.6866 | Params: pos=0.95, trail=0.25, stop=0.25
[I 2025-10-17 17:27:23,177] Trial 56 finished with value: 0.686603799313812 and parameters: {'position_fraction': 0.95, 'trailing_stop_pct': 0.25, 'stop_loss_pct': 0.25}. Best is trial 10 with value: 0.686603799313812.
Trial  57: Return=116.88% | Sharpe=1.03 | MDD=12.67% | Trades=30 | Score=0.6308 | Params: pos=0.85, trail=0.15, stop=0.25
[I 2025-10-17 17:27:23,289] Trial 57 finished with value: 0.6308089478454886 and parameters: {'position_fraction': 0.85, 'trailing_stop_pct': 0.15, 'stop_loss_pct': 0.25}. Best is trial 10 with value: 0.686603799313812.
Trial  58: Return=125.91% | Sharpe=1.03 | MDD=13.36% | Trades=30 | Score=0.6582 | Params: pos=0.90, trail=0.15, stop=0.25
[I 2025-10-17 17:27:23,406] Trial 58 finished with value: 0.6582165814094908 and parameters: {'position_fraction': 0.8999999999999999, 'trailing_stop_pct': 0.15, 'stop_loss_pct': 0.25}. Best is trial 10 with value: 0.686603799313812.
Trial  59: Return=135.20% | Sharpe=1.03 | MDD=14.04% | Trades=30 | Score=0.6866 | Params: pos=0.95, trail=0.20, stop=0.20
[I 2025-10-17 17:27:23,523] Trial 59 finished with value: 0.686603799313812 and parameters: {'position_fraction': 0.95, 'trailing_stop_pct': 0.2, 'stop_loss_pct': 0.2}. Best is trial 10 with value: 0.686603799313812.
Trial  60: Return= 99.61% | Sharpe=1.03 | MDD=11.29% | Trades=30 | Score=0.5789 | Params: pos=0.75, trail=0.25, stop=0.25
[I 2025-10-17 17:27:23,632] Trial 60 finished with value: 0.5788715317642358 and parameters: {'position_fraction': 0.75, 'trailing_stop_pct': 0.25, 'stop_loss_pct': 0.25}. Best is trial 10 with value: 0.686603799313812.
Trial  61: Return=135.20% | Sharpe=1.03 | MDD=14.04% | Trades=30 | Score=0.6866 | Params: pos=0.95, trail=0.15, stop=0.20
[I 2025-10-17 17:27:23,741] Trial 61 finished with value: 0.686603799313812 and parameters: {'position_fraction': 0.95, 'trailing_stop_pct': 0.15, 'stop_loss_pct': 0.2}. Best is trial 10 with value: 0.686603799313812.
Trial  62: Return=135.20% | Sharpe=1.03 | MDD=14.04% | Trades=30 | Score=0.6866 | Params: pos=0.95, trail=0.15, stop=0.25
[I 2025-10-17 17:27:23,848] Trial 62 finished with value: 0.686603799313812 and parameters: {'position_fraction': 0.95, 'trailing_stop_pct': 0.15, 'stop_loss_pct': 0.25}. Best is trial 10 with value: 0.686603799313812.
Trial  63: Return=135.20% | Sharpe=1.03 | MDD=14.04% | Trades=30 | Score=0.6866 | Params: pos=0.95, trail=0.15, stop=0.25
[I 2025-10-17 17:27:23,957] Trial 63 finished with value: 0.686603799313812 and parameters: {'position_fraction': 0.95, 'trailing_stop_pct': 0.15, 'stop_loss_pct': 0.25}. Best is trial 10 with value: 0.686603799313812.
Trial  64: Return=135.20% | Sharpe=1.03 | MDD=14.04% | Trades=30 | Score=0.6866 | Params: pos=0.95, trail=0.15, stop=0.15
[I 2025-10-17 17:27:24,066] Trial 64 finished with value: 0.686603799313812 and parameters: {'position_fraction': 0.95, 'trailing_stop_pct': 0.15, 'stop_loss_pct': 0.15000000000000002}. Best is trial 10 with value: 0.686603799313812.
Trial  65: Return=135.20% | Sharpe=1.03 | MDD=14.04% | Trades=30 | Score=0.6866 | Params: pos=0.95, trail=0.15, stop=0.20
[I 2025-10-17 17:27:24,173] Trial 65 finished with value: 0.686603799313812 and parameters: {'position_fraction': 0.95, 'trailing_stop_pct': 0.15, 'stop_loss_pct': 0.2}. Best is trial 10 with value: 0.686603799313812.
Trial  66: Return=125.91% | Sharpe=1.03 | MDD=13.36% | Trades=30 | Score=0.6582 | Params: pos=0.90, trail=0.20, stop=0.25
[I 2025-10-17 17:27:24,281] Trial 66 finished with value: 0.6582165814094908 and parameters: {'position_fraction': 0.8999999999999999, 'trailing_stop_pct': 0.2, 'stop_loss_pct': 0.25}. Best is trial 10 with value: 0.686603799313812.
Trial  67: Return=125.91% | Sharpe=1.03 | MDD=13.36% | Trades=30 | Score=0.6582 | Params: pos=0.90, trail=0.30, stop=0.10
[I 2025-10-17 17:27:24,388] Trial 67 finished with value: 0.6582165814094908 and parameters: {'position_fraction': 0.8999999999999999, 'trailing_stop_pct': 0.3, 'stop_loss_pct': 0.1}. Best is trial 10 with value: 0.686603799313812.
Trial  68: Return=135.20% | Sharpe=1.03 | MDD=14.04% | Trades=30 | Score=0.6866 | Params: pos=0.95, trail=0.15, stop=0.25
[I 2025-10-17 17:27:24,496] Trial 68 finished with value: 0.686603799313812 and parameters: {'position_fraction': 0.95, 'trailing_stop_pct': 0.15, 'stop_loss_pct': 0.25}. Best is trial 10 with value: 0.686603799313812.
Trial  69: Return=108.12% | Sharpe=1.03 | MDD=11.98% | Trades=30 | Score=0.6044 | Params: pos=0.80, trail=0.15, stop=0.25
[I 2025-10-17 17:27:24,604] Trial 69 finished with value: 0.604365679824856 and parameters: {'position_fraction': 0.7999999999999999, 'trailing_stop_pct': 0.15, 'stop_loss_pct': 0.25}. Best is trial 10 with value: 0.686603799313812.
Trial  70: Return=125.91% | Sharpe=1.03 | MDD=13.36% | Trades=30 | Score=0.6582 | Params: pos=0.90, trail=0.25, stop=0.20
[I 2025-10-17 17:27:24,739] Trial 70 finished with value: 0.6582165814094908 and parameters: {'position_fraction': 0.8999999999999999, 'trailing_stop_pct': 0.25, 'stop_loss_pct': 0.2}. Best is trial 10 with value: 0.686603799313812.
Trial  71: Return=135.20% | Sharpe=1.03 | MDD=14.04% | Trades=30 | Score=0.6866 | Params: pos=0.95, trail=0.15, stop=0.25
[I 2025-10-17 17:27:24,848] Trial 71 finished with value: 0.686603799313812 and parameters: {'position_fraction': 0.95, 'trailing_stop_pct': 0.15, 'stop_loss_pct': 0.25}. Best is trial 10 with value: 0.686603799313812.Best trial: 10. Best value: 0.686604:  95%|█████████▌| 95/100 [00:10<00:00,  9.17it/s]Best trial: 10. Best value: 0.686604:  95%|█████████▌| 95/100 [00:10<00:00,  9.17it/s]Best trial: 10. Best value: 0.686604:  96%|█████████▌| 96/100 [00:10<00:00,  9.18it/s]                                                                                      Best trial: 10. Best value: 0.686604:  96%|█████████▌| 96/100 [00:10<00:00,  9.18it/s]Best trial: 10. Best value: 0.686604:  96%|█████████▌| 96/100 [00:10<00:00,  9.18it/s]Best trial: 10. Best value: 0.686604:  97%|█████████▋| 97/100 [00:10<00:00,  9.22it/s]                                                                                      Best trial: 10. Best value: 0.686604:  97%|█████████▋| 97/100 [00:10<00:00,  9.22it/s]Best trial: 10. Best value: 0.686604:  97%|█████████▋| 97/100 [00:10<00:00,  9.22it/s]Best trial: 10. Best value: 0.686604:  98%|█████████▊| 98/100 [00:10<00:00,  9.25it/s]                                                                                      Best trial: 10. Best value: 0.686604:  98%|█████████▊| 98/100 [00:10<00:00,  9.25it/s]Best trial: 10. Best value: 0.686604:  98%|█████████▊| 98/100 [00:10<00:00,  9.25it/s]Best trial: 10. Best value: 0.686604:  99%|█████████▉| 99/100 [00:10<00:00,  9.28it/s]                                                                                      Best trial: 10. Best value: 0.686604:  99%|█████████▉| 99/100 [00:10<00:00,  9.28it/s]Best trial: 10. Best value: 0.686604:  99%|█████████▉| 99/100 [00:10<00:00,  9.28it/s]Best trial: 10. Best value: 0.686604: 100%|██████████| 100/100 [00:10<00:00,  9.27it/s]Best trial: 10. Best value: 0.686604: 100%|██████████| 100/100 [00:10<00:00,  9.18it/s]

Trial  72: Return=135.20% | Sharpe=1.03 | MDD=14.04% | Trades=30 | Score=0.6866 | Params: pos=0.95, trail=0.15, stop=0.25
[I 2025-10-17 17:27:24,955] Trial 72 finished with value: 0.686603799313812 and parameters: {'position_fraction': 0.95, 'trailing_stop_pct': 0.15, 'stop_loss_pct': 0.25}. Best is trial 10 with value: 0.686603799313812.
Trial  73: Return=135.20% | Sharpe=1.03 | MDD=14.04% | Trades=30 | Score=0.6866 | Params: pos=0.95, trail=0.15, stop=0.25
[I 2025-10-17 17:27:25,063] Trial 73 finished with value: 0.686603799313812 and parameters: {'position_fraction': 0.95, 'trailing_stop_pct': 0.15, 'stop_loss_pct': 0.25}. Best is trial 10 with value: 0.686603799313812.
Trial  74: Return=135.20% | Sharpe=1.03 | MDD=14.04% | Trades=30 | Score=0.6866 | Params: pos=0.95, trail=0.15, stop=0.25
[I 2025-10-17 17:27:25,170] Trial 74 finished with value: 0.686603799313812 and parameters: {'position_fraction': 0.95, 'trailing_stop_pct': 0.15, 'stop_loss_pct': 0.25}. Best is trial 10 with value: 0.686603799313812.
Trial  75: Return=135.20% | Sharpe=1.03 | MDD=14.04% | Trades=30 | Score=0.6866 | Params: pos=0.95, trail=0.15, stop=0.25
[I 2025-10-17 17:27:25,300] Trial 75 finished with value: 0.686603799313812 and parameters: {'position_fraction': 0.95, 'trailing_stop_pct': 0.15, 'stop_loss_pct': 0.25}. Best is trial 10 with value: 0.686603799313812.
Trial  76: Return=135.20% | Sharpe=1.03 | MDD=14.04% | Trades=30 | Score=0.6866 | Params: pos=0.95, trail=0.15, stop=0.25
[I 2025-10-17 17:27:25,414] Trial 76 finished with value: 0.686603799313812 and parameters: {'position_fraction': 0.95, 'trailing_stop_pct': 0.15, 'stop_loss_pct': 0.25}. Best is trial 10 with value: 0.686603799313812.
Trial  77: Return=135.20% | Sharpe=1.03 | MDD=14.04% | Trades=30 | Score=0.6866 | Params: pos=0.95, trail=0.20, stop=0.25
[I 2025-10-17 17:27:25,522] Trial 77 finished with value: 0.686603799313812 and parameters: {'position_fraction': 0.95, 'trailing_stop_pct': 0.2, 'stop_loss_pct': 0.25}. Best is trial 10 with value: 0.686603799313812.
Trial  78: Return=135.20% | Sharpe=1.03 | MDD=14.04% | Trades=30 | Score=0.6866 | Params: pos=0.95, trail=0.25, stop=0.25
[I 2025-10-17 17:27:25,631] Trial 78 finished with value: 0.686603799313812 and parameters: {'position_fraction': 0.95, 'trailing_stop_pct': 0.25, 'stop_loss_pct': 0.25}. Best is trial 10 with value: 0.686603799313812.
Trial  79: Return=125.91% | Sharpe=1.03 | MDD=13.36% | Trades=30 | Score=0.6582 | Params: pos=0.90, trail=0.15, stop=0.25
[I 2025-10-17 17:27:25,739] Trial 79 finished with value: 0.6582165814094908 and parameters: {'position_fraction': 0.8999999999999999, 'trailing_stop_pct': 0.15, 'stop_loss_pct': 0.25}. Best is trial 10 with value: 0.686603799313812.
Trial  80: Return=135.20% | Sharpe=1.03 | MDD=14.04% | Trades=30 | Score=0.6866 | Params: pos=0.95, trail=0.20, stop=0.20
[I 2025-10-17 17:27:25,847] Trial 80 finished with value: 0.686603799313812 and parameters: {'position_fraction': 0.95, 'trailing_stop_pct': 0.2, 'stop_loss_pct': 0.2}. Best is trial 10 with value: 0.686603799313812.
Trial  81: Return=135.20% | Sharpe=1.03 | MDD=14.04% | Trades=30 | Score=0.6866 | Params: pos=0.95, trail=0.15, stop=0.25
[I 2025-10-17 17:27:25,955] Trial 81 finished with value: 0.686603799313812 and parameters: {'position_fraction': 0.95, 'trailing_stop_pct': 0.15, 'stop_loss_pct': 0.25}. Best is trial 10 with value: 0.686603799313812.
Trial  82: Return=135.20% | Sharpe=1.03 | MDD=14.04% | Trades=30 | Score=0.6866 | Params: pos=0.95, trail=0.15, stop=0.25
[I 2025-10-17 17:27:26,061] Trial 82 finished with value: 0.686603799313812 and parameters: {'position_fraction': 0.95, 'trailing_stop_pct': 0.15, 'stop_loss_pct': 0.25}. Best is trial 10 with value: 0.686603799313812.
Trial  83: Return=135.20% | Sharpe=1.03 | MDD=14.04% | Trades=30 | Score=0.6866 | Params: pos=0.95, trail=0.15, stop=0.25
[I 2025-10-17 17:27:26,167] Trial 83 finished with value: 0.686603799313812 and parameters: {'position_fraction': 0.95, 'trailing_stop_pct': 0.15, 'stop_loss_pct': 0.25}. Best is trial 10 with value: 0.686603799313812.
Trial  84: Return=135.20% | Sharpe=1.03 | MDD=14.04% | Trades=30 | Score=0.6866 | Params: pos=0.95, trail=0.15, stop=0.25
[I 2025-10-17 17:27:26,276] Trial 84 finished with value: 0.686603799313812 and parameters: {'position_fraction': 0.95, 'trailing_stop_pct': 0.15, 'stop_loss_pct': 0.25}. Best is trial 10 with value: 0.686603799313812.
Trial  85: Return=125.91% | Sharpe=1.03 | MDD=13.36% | Trades=30 | Score=0.6582 | Params: pos=0.90, trail=0.15, stop=0.25
[I 2025-10-17 17:27:26,385] Trial 85 finished with value: 0.6582165814094908 and parameters: {'position_fraction': 0.8999999999999999, 'trailing_stop_pct': 0.15, 'stop_loss_pct': 0.25}. Best is trial 10 with value: 0.686603799313812.
Trial  86: Return=135.20% | Sharpe=1.03 | MDD=14.04% | Trades=30 | Score=0.6866 | Params: pos=0.95, trail=0.15, stop=0.25
[I 2025-10-17 17:27:26,493] Trial 86 finished with value: 0.686603799313812 and parameters: {'position_fraction': 0.95, 'trailing_stop_pct': 0.15, 'stop_loss_pct': 0.25}. Best is trial 10 with value: 0.686603799313812.
Trial  87: Return=135.20% | Sharpe=1.03 | MDD=14.04% | Trades=30 | Score=0.6866 | Params: pos=0.95, trail=0.25, stop=0.25
[I 2025-10-17 17:27:26,603] Trial 87 finished with value: 0.686603799313812 and parameters: {'position_fraction': 0.95, 'trailing_stop_pct': 0.25, 'stop_loss_pct': 0.25}. Best is trial 10 with value: 0.686603799313812.
Trial  88: Return=135.20% | Sharpe=1.03 | MDD=14.04% | Trades=30 | Score=0.6866 | Params: pos=0.95, trail=0.15, stop=0.25
[I 2025-10-17 17:27:26,711] Trial 88 finished with value: 0.686603799313812 and parameters: {'position_fraction': 0.95, 'trailing_stop_pct': 0.15, 'stop_loss_pct': 0.25}. Best is trial 10 with value: 0.686603799313812.
Trial  89: Return=135.20% | Sharpe=1.03 | MDD=14.04% | Trades=30 | Score=0.6866 | Params: pos=0.95, trail=0.25, stop=0.15
[I 2025-10-17 17:27:26,821] Trial 89 finished with value: 0.686603799313812 and parameters: {'position_fraction': 0.95, 'trailing_stop_pct': 0.25, 'stop_loss_pct': 0.15000000000000002}. Best is trial 10 with value: 0.686603799313812.
Trial  90: Return=135.20% | Sharpe=1.03 | MDD=14.04% | Trades=30 | Score=0.6866 | Params: pos=0.95, trail=0.15, stop=0.25
[I 2025-10-17 17:27:26,930] Trial 90 finished with value: 0.686603799313812 and parameters: {'position_fraction': 0.95, 'trailing_stop_pct': 0.15, 'stop_loss_pct': 0.25}. Best is trial 10 with value: 0.686603799313812.
Trial  91: Return=135.20% | Sharpe=1.03 | MDD=14.04% | Trades=30 | Score=0.6866 | Params: pos=0.95, trail=0.15, stop=0.25
[I 2025-10-17 17:27:27,040] Trial 91 finished with value: 0.686603799313812 and parameters: {'position_fraction': 0.95, 'trailing_stop_pct': 0.15, 'stop_loss_pct': 0.25}. Best is trial 10 with value: 0.686603799313812.
Trial  92: Return=135.20% | Sharpe=1.03 | MDD=14.04% | Trades=30 | Score=0.6866 | Params: pos=0.95, trail=0.15, stop=0.25
[I 2025-10-17 17:27:27,149] Trial 92 finished with value: 0.686603799313812 and parameters: {'position_fraction': 0.95, 'trailing_stop_pct': 0.15, 'stop_loss_pct': 0.25}. Best is trial 10 with value: 0.686603799313812.
Trial  93: Return=135.20% | Sharpe=1.03 | MDD=14.04% | Trades=30 | Score=0.6866 | Params: pos=0.95, trail=0.15, stop=0.25
[I 2025-10-17 17:27:27,258] Trial 93 finished with value: 0.686603799313812 and parameters: {'position_fraction': 0.95, 'trailing_stop_pct': 0.15, 'stop_loss_pct': 0.25}. Best is trial 10 with value: 0.686603799313812.
Trial  94: Return=135.20% | Sharpe=1.03 | MDD=14.04% | Trades=30 | Score=0.6866 | Params: pos=0.95, trail=0.15, stop=0.25
[I 2025-10-17 17:27:27,367] Trial 94 finished with value: 0.686603799313812 and parameters: {'position_fraction': 0.95, 'trailing_stop_pct': 0.15, 'stop_loss_pct': 0.25}. Best is trial 10 with value: 0.686603799313812.
Trial  95: Return=135.20% | Sharpe=1.03 | MDD=14.04% | Trades=30 | Score=0.6866 | Params: pos=0.95, trail=0.15, stop=0.25
[I 2025-10-17 17:27:27,475] Trial 95 finished with value: 0.686603799313812 and parameters: {'position_fraction': 0.95, 'trailing_stop_pct': 0.15, 'stop_loss_pct': 0.25}. Best is trial 10 with value: 0.686603799313812.
Trial  96: Return= 91.36% | Sharpe=1.02 | MDD=10.58% | Trades=30 | Score=0.5543 | Params: pos=0.70, trail=0.15, stop=0.25
[I 2025-10-17 17:27:27,583] Trial 96 finished with value: 0.5543112388671698 and parameters: {'position_fraction': 0.7, 'trailing_stop_pct': 0.15, 'stop_loss_pct': 0.25}. Best is trial 10 with value: 0.686603799313812.
Trial  97: Return=135.20% | Sharpe=1.03 | MDD=14.04% | Trades=30 | Score=0.6866 | Params: pos=0.95, trail=0.20, stop=0.25
[I 2025-10-17 17:27:27,690] Trial 97 finished with value: 0.686603799313812 and parameters: {'position_fraction': 0.95, 'trailing_stop_pct': 0.2, 'stop_loss_pct': 0.25}. Best is trial 10 with value: 0.686603799313812.
Trial  98: Return=125.91% | Sharpe=1.03 | MDD=13.36% | Trades=30 | Score=0.6582 | Params: pos=0.90, trail=0.15, stop=0.25
[I 2025-10-17 17:27:27,797] Trial 98 finished with value: 0.6582165814094908 and parameters: {'position_fraction': 0.8999999999999999, 'trailing_stop_pct': 0.15, 'stop_loss_pct': 0.25}. Best is trial 10 with value: 0.686603799313812.
Trial  99: Return=135.20% | Sharpe=1.03 | MDD=14.04% | Trades=30 | Score=0.6866 | Params: pos=0.95, trail=0.25, stop=0.25
[I 2025-10-17 17:27:27,905] Trial 99 finished with value: 0.686603799313812 and parameters: {'position_fraction': 0.95, 'trailing_stop_pct': 0.25, 'stop_loss_pct': 0.25}. Best is trial 10 with value: 0.686603799313812.

================================================================================
OPTIMIZATION RESULTS
================================================================================

Best Score: 0.6866

Best Parameters:
  - position_fraction: 0.95
  - trailing_stop_pct: 0.15
  - stop_loss_pct: 0.25

================================================================================
BEST TRIAL BACKTEST
================================================================================

=== 최종 성과 ===
수익률: +135.20% (vs Buy&Hold: -12.45%p)
Sharpe Ratio: 1.03
Max Drawdown: 14.04%
총 거래: 30회 | 승률: 56.7%
Profit Factor: 4.05

170% 목표 달성: ❌ (135.20% vs 170%)

Optimized config saved to: config_optimized.json
================================================================================
